### ISSUE TITLE
Container ipv6 getaddrinfo dns resolution issues on fabric8 openshift

### ISSUE THREAD

**Issue by johanvdb** [fabric8io/fabric8#6085]
I am trying to deploy a wordpress docker that talks to a spring boot microservice using the fabric8 openshift vagrant local setup (http://fabric8.io/guide/getStartedVagrant.html)

I get DNS lookup problems whereby glibc is trying to resolve both AAAA and A records for a domain, but then the failure on AAAA breaks the request even though an A record exists.

The following was tested on debian:latest f854eed3f31f as well as on the official wordpress docker.

```
# apt-get update
Err http://security.debian.org jessie/updates InRelease
Err http://security.debian.org jessie/updates Release.gpg
  Could not resolve 'security.debian.org'
...
```

Ping however works (Maybe because it uses gethostbyname rather than getaddrinfo?):

```
# ping security.debian.org
PING security.debian.org (212.211.132.32): 56 data bytes
64 bytes from 212.211.132.32: icmp_seq=0 ttl=61 time=169.647 ms
```

I tried to disable the ipv6 support in docker images by modifying the docker daemon startup to include --ipv6=false but containers still see ipv6 support:

```
[vagrant@vagrant ~]$ ps -Af | grep "docker daemon" | grep -v grep
root      1020     1  2 18:36 ?        00:00:20 /usr/bin/docker daemon -H fd:// -H tcp://0.0.0.0:2375 --selinux-enabled --insecure-registry=172.0.0.0/8 --log-level=warn --ipv6=false
```

```
[vagrant@vagrant ~]$ oc debug debug-rc-0m7dk
Debugging with pod/debug-rc-0m7dk-debug, original command: <image entrypoint>
Waiting for pod to start ...
Pod IP: 172.17.0.12

Hit enter for command prompt

# ip addr
1: lo: <LOOPBACK,UP,LOWER_UP> mtu 65536 qdisc noqueue state UNKNOWN group default 
    link/loopback 00:00:00:00:00:00 brd 00:00:00:00:00:00
    inet 127.0.0.1/8 scope host lo
       valid_lft forever preferred_lft forever
    inet6 ::1/128 scope host 
       valid_lft forever preferred_lft forever
27: eth0@if28: <BROADCAST,MULTICAST,UP,LOWER_UP> mtu 1500 qdisc noqueue state UP group default 
    link/ether 02:42:ac:11:00:0c brd ff:ff:ff:ff:ff:ff
    inet 172.17.0.12/16 scope global eth0
       valid_lft forever preferred_lft forever
    inet6 fe80::42:acff:fe11:c/64 scope link tentative dadfailed 
       valid_lft forever preferred_lft forever
```

**Comment by johanvdb** [comment]
I have been able to pin it down to the following line in /etc/resolv.conf

```
options ndots:5
```

If I remove it, all the issues go away. Wordpress can install plugins and apt-get can find packages. The next step is to find out why and how to fix it permanently...

**Comment by jimmidyson** [comment]
That's a setting from Kubernetes/OpenShift itself that fabric8 has no control over. I wonder if there are any similar issues in https://github.com/kubernetes/kubernetes or https://github.com/openshift/origin ?

**Comment by johanvdb** [comment]
I just tried a stock standard openshift vagrant, the debian:stable and debian:latest images and their containers look identical, yet they work. I am stumped...

```
[vagrant@localhost ~]$ oc debug pod/debug-rc-qknar
Debugging with pod/debug-rc-qknar-debug, original command: <image entrypoint>
Waiting for pod to start ...

Hit enter for command prompt

# cat /etc/resolv.conf
search sample.svc.cluster.local svc.cluster.local cluster.local vdb.local
nameserver 10.2.2.2
nameserver 10.0.2.3
options ndots:5
```

```
# apt-get update
Get:1 http://security.debian.org jessie/updates InRelease [63.1 kB]
Ign http://httpredir.debian.org jessie InRelease           
Get:2 http://httpredir.debian.org jessie-updates InRelease [142 kB]
...
```

```
# ip addr
1: lo: <LOOPBACK,UP,LOWER_UP> mtu 65536 qdisc noqueue state UNKNOWN group default 
    link/loopback 00:00:00:00:00:00 brd 00:00:00:00:00:00
    inet 127.0.0.1/8 scope host lo
       valid_lft forever preferred_lft forever
    inet6 ::1/128 scope host 
       valid_lft forever preferred_lft forever
37: eth0@if38: <BROADCAST,MULTICAST,UP,LOWER_UP> mtu 1500 qdisc noqueue state UP group default 
    link/ether 02:42:ac:11:00:10 brd ff:ff:ff:ff:ff:ff
    inet 172.17.0.16/16 scope global eth0
       valid_lft forever preferred_lft forever
    inet6 fe80::42:acff:fe11:10/64 scope link tentative dadfailed 
       valid_lft forever preferred_lft forever
```

**Comment by johanvdb** [comment]
The following tcpdumps are on the Fabric8 OpenShift vagrant. It seems that the Fabric8 primary DNS is doing forwarding whereas the clean OpenShift internal DNS fails on public lookups and then falls over to secondary DNS. Of note is the fact that the Fabric8 DNS final result for the AAAA is "NOTIMP", where on OpenShift the final result is "CNAME wordpress.org. (114)". 

With ndots:5 on Fabric8 the lookup fails:
```
# cat /etc/resolv.conf  
search casinorush.svc.cluster.local svc.cluster.local cluster.local
nameserver 172.30.0.1
nameserver 10.0.2.3
options ndots:5
# curl https://www.wordpress.org
curl: (6) Could not resolve host: www.wordpress.org
```

```
04:18:06.044932 IP 172.17.0.7.57698 > 172.30.0.1.53: 61539+ A? www.wordpress.org.casinorush.svc.cluster.local. (64)
04:18:06.044980 IP 172.17.0.7.57698 > 172.30.0.1.53: 20185+ AAAA? www.wordpress.org.casinorush.svc.cluster.local. (64)
04:18:06.045997 IP 172.30.0.1.53 > 172.17.0.7.57698: 61539 NXDomain* 0/1/0 (118)
04:18:06.046065 IP 172.30.0.1.53 > 172.17.0.7.57698: 20185 NXDomain* 0/1/0 (118)
04:18:06.046201 IP 172.17.0.7.40556 > 172.30.0.1.53: 27734+ A? www.wordpress.org.svc.cluster.local. (53)
04:18:06.046238 IP 172.17.0.7.40556 > 172.30.0.1.53: 36569+ AAAA? www.wordpress.org.svc.cluster.local. (53)
04:18:06.047308 IP 172.30.0.1.53 > 172.17.0.7.40556: 27734 NXDomain* 0/1/0 (107)
04:18:06.047375 IP 172.30.0.1.53 > 172.17.0.7.40556: 36569 NXDomain* 0/1/0 (107)
04:18:06.047543 IP 172.17.0.7.43540 > 172.30.0.1.53: 43388+ A? www.wordpress.org.cluster.local. (49)
04:18:06.047719 IP 172.17.0.7.43540 > 172.30.0.1.53: 42532+ AAAA? www.wordpress.org.cluster.local. (49)
04:18:06.048411 IP 172.30.0.1.53 > 172.17.0.7.43540: 43388 NXDomain* 0/1/0 (103)
04:18:06.048479 IP 172.30.0.1.53 > 172.17.0.7.43540: 42532 NXDomain* 0/1/0 (103)
04:18:06.048538 IP 172.17.0.7.53694 > 172.30.0.1.53: 45511+ A? www.wordpress.org. (35)
04:18:06.048554 IP 172.17.0.7.53694 > 172.30.0.1.53: 6767+ AAAA? www.wordpress.org. (35)
04:18:07.556355 IP 172.30.0.1.53 > 172.17.0.7.53694: 6767 NotImp 0/0/0 (35)
04:18:07.556511 IP 172.30.0.1.53 > 172.17.0.7.53694: 45511 3/0/0 CNAME wordpress.org., A 66.155.40.249, A 66.155.40.250 (81)
```

Without ndots:5 on Fabric8 the lookup succeeds:
```
# cat /etc/resolv.conf
search casinorush.svc.cluster.local svc.cluster.local cluster.local
nameserver 172.30.0.1
nameserver 10.0.2.3
# curl https://www.wordpress.org
<html>
<head><title>301 Moved Permanently</title></head>
<body bgcolor="white">
<center><h1>301 Moved Permanently</h1></center>
<hr><center>nginx</center>
</body>
</html>
```

```
04:20:56.024027 IP 172.17.0.7.35865 > 172.30.0.1.53: 28428+ A? www.wordpress.org. (35)
04:20:56.024076 IP 172.17.0.7.35865 > 172.30.0.1.53: 29226+ AAAA? www.wordpress.org. (35)
04:20:56.036522 IP 172.30.0.1.53 > 172.17.0.7.35865: 29226 NotImp 0/0/0 (35)
04:20:56.036713 IP 172.30.0.1.53 > 172.17.0.7.35865: 28428 3/0/0 CNAME wordpress.org., A 66.155.40.249, A 66.155.40.250 (81)
```

On a clean OpenShift vagrant with ndots:5 enabled the lookup and curl work:
```
# cat /etc/resolv.conf
search sample.svc.cluster.local svc.cluster.local cluster.local vdb.local
nameserver 10.2.2.2
nameserver 10.0.2.3
options ndots:5
# curl https://www.wordpress.org
<html>
<head><title>301 Moved Permanently</title></head>
<body bgcolor="white">
<center><h1>301 Moved Permanently</h1></center>
<hr><center>nginx</center>
</body>
</html>
```

```
04:00:29.243174 IP 172.17.0.13.42829 > 10.2.2.2.53: 31836+ A? www.wordpress.org.sample.svc.cluster.local. (60)
04:00:29.243392 IP 172.17.0.13.42829 > 10.2.2.2.53: 22207+ AAAA? www.wordpress.org.sample.svc.cluster.local. (60)
04:00:29.244549 IP 10.2.2.2.53 > 172.17.0.13.42829: 31836 NXDomain* 0/1/0 (114)
04:00:29.244882 IP 10.2.2.2.53 > 172.17.0.13.42829: 22207 NXDomain* 0/1/0 (114)
04:00:29.245048 IP 172.17.0.13.51242 > 10.2.2.2.53: 39093+ A? www.wordpress.org.svc.cluster.local. (53)
04:00:29.245226 IP 172.17.0.13.51242 > 10.2.2.2.53: 2741+ AAAA? www.wordpress.org.svc.cluster.local. (53)
04:00:29.246195 IP 10.2.2.2.53 > 172.17.0.13.51242: 39093 NXDomain* 0/1/0 (107)
04:00:29.246257 IP 10.2.2.2.53 > 172.17.0.13.51242: 2741 NXDomain* 0/1/0 (107)
04:00:29.246326 IP 172.17.0.13.45304 > 10.2.2.2.53: 40707+ A? www.wordpress.org.cluster.local. (49)
04:00:29.246552 IP 172.17.0.13.45304 > 10.2.2.2.53: 15448+ AAAA? www.wordpress.org.cluster.local. (49)
04:00:29.247188 IP 10.2.2.2.53 > 172.17.0.13.45304: 40707 NXDomain* 0/1/0 (103)
04:00:29.247224 IP 10.2.2.2.53 > 172.17.0.13.45304: 15448 NXDomain* 0/1/0 (103)
04:00:29.247328 IP 172.17.0.13.45743 > 10.2.2.2.53: 20163+ A? www.wordpress.org.vdb.local. (45)
04:00:29.247457 IP 172.17.0.13.45743 > 10.2.2.2.53: 31284+ AAAA? www.wordpress.org.vdb.local. (45)
04:00:29.247686 IP 10.2.2.2.53 > 172.17.0.13.45743: 20163 ServFail- 0/0/0 (45)
04:00:29.248117 IP 10.2.2.2.53 > 172.17.0.13.45743: 31284 ServFail- 0/0/0 (45)
04:00:29.248236 IP 172.17.0.13.51388 > 10.0.2.3.53: 20163+ A? www.wordpress.org.vdb.local. (45)
04:00:29.248276 IP 10.0.2.15.51388 > 10.0.2.3.53: 20163+ A? www.wordpress.org.vdb.local. (45)
04:00:29.248368 IP 172.17.0.13.51388 > 10.0.2.3.53: 31284+ AAAA? www.wordpress.org.vdb.local. (45)
04:00:29.248377 IP 10.0.2.15.51388 > 10.0.2.3.53: 31284+ AAAA? www.wordpress.org.vdb.local. (45)
04:00:29.251849 IP 10.0.2.3.53 > 10.0.2.15.51388: 20163 NXDomain* 0/1/0 (98)
04:00:29.251864 IP 10.0.2.3.53 > 172.17.0.13.51388: 20163 NXDomain* 0/1/0 (98)
04:00:29.252283 IP 10.0.2.3.53 > 10.0.2.15.51388: 31284 NXDomain* 0/1/0 (98)
04:00:29.252296 IP 10.0.2.3.53 > 172.17.0.13.51388: 31284 NXDomain* 0/1/0 (98)
04:00:29.252600 IP 172.17.0.13.48381 > 10.2.2.2.53: 50863+ A? www.wordpress.org. (35)
04:00:29.252758 IP 172.17.0.13.48381 > 10.2.2.2.53: 1074+ AAAA? www.wordpress.org. (35)
04:00:29.252978 IP 10.2.2.2.53 > 172.17.0.13.48381: 50863 ServFail- 0/0/0 (35)
04:00:29.253126 IP 10.2.2.2.53 > 172.17.0.13.48381: 1074 ServFail- 0/0/0 (35)
04:00:29.253388 IP 172.17.0.13.38231 > 10.0.2.3.53: 50863+ A? www.wordpress.org. (35)
04:00:29.253418 IP 10.0.2.15.38231 > 10.0.2.3.53: 50863+ A? www.wordpress.org. (35)
04:00:29.253454 IP 172.17.0.13.38231 > 10.0.2.3.53: 1074+ AAAA? www.wordpress.org. (35)
04:00:29.253459 IP 10.0.2.15.38231 > 10.0.2.3.53: 1074+ AAAA? www.wordpress.org. (35)
04:00:29.555849 IP 10.0.2.3.53 > 10.0.2.15.38231: 50863 3/6/12 CNAME wordpress.org., A 66.155.40.249, A 66.155.40.250 (483)
04:00:29.555887 IP 10.0.2.3.53 > 172.17.0.13.38231: 50863 3/6/12 CNAME wordpress.org., A 66.155.40.249, A 66.155.40.250 (483)
04:00:29.835271 IP 10.0.2.3.53 > 10.0.2.15.38231: 1074 1/1/0 CNAME wordpress.org. (114)
04:00:29.835304 IP 10.0.2.3.53 > 172.17.0.13.38231: 1074 1/1/0 CNAME wordpress.org. (114)
```

**Comment by jimmidyson** [comment]
Can you check if they're running the same version of openshift? Fabric8 vagrant runs 1.3 alpha which has forwarding DNS enabled. This was a change from openshift 1.2 to work with certain base images that have different DNS lookup semantics, e.g. Alpine's musl libc treats all nameservers as equal priority, not primary, secondary, etc.

**Comment by johanvdb** [comment]
I used https://github.com/fabric8io/fabric8-installer/tree/master/vagrant/openshift as of 2 days ago. 

```
[vagrant@vagrant ~]$ openshift version
openshift v1.3.0-alpha.1
kubernetes v1.3.0-alpha.1-331-g0522e63
etcd 2.3.0
```

**Comment by jimmidyson** [comment]
You said "On a clean OpenShift vagrant" - did you mean the openshift vagrant set up? What version of openshift is that running? I think it's a bug in the openshift 1.3 alpha DNS that we  run in our fabric8  & just want to confirm before reporting upstream.

**Comment by johanvdb** [comment]
Mmm, just did a hack on the Vagrantfile to run 1.2.0 and it resolves the problem.

**Comment by jimmidyson** [comment]
OK I'll raise this upstream. Thanks.
